<?xml version="1.0" encoding="iso-8859-1"?>
<!DOCTYPE rules PUBLIC "-//W3C//DTD GrammarRules 0.1//EN" "rules.dtd">
<!--
Rules: Words that should not be used
(c) 2001,2002,2003 Daniel Naber, daniel.naber@t-online.de, 2001-12-30
$Id: enwords.xml,v 1.1 2004-05-23 21:46:20 dnaber Exp $
-->
<rules>

	<!-- fixme: add >'s< (but only as VBZ, not POS) too -->
	<!-- the tokenizer splits "don't" into "do n't" because the tagger needs
		it that way, so we use two tokens: -->
	<rule id="SHORT_FORMS_NOT" name="Avoid short forms (don't etc.)">
		<pattern lang="en">".*" "n't"</pattern>
		<message>Suggestion: use a long form like <em>do not</em> instead of <em>don't</em> for formal texts.</message>
		<example type="correct"><em>Do not</em> open the box unless you've read the instructions.</example>
		<example type="incorrect"><em>Don't</em> open the box unless you've read the instructions.</example>
	</rule>
	
	<rule id="SHORT_FORMS_WILL" name="Avoid short forms (I'll etc.)">
		<pattern lang="en">".*" "'ll"</pattern>
		<message>Suggestion: use a long form like <em>\1 will</em> instead for formal texts.</message>
		<example type="correct"><em>He will</em> open the box.</example>
		<example type="incorrect"><em>He'll</em> open the box.</example>
	</rule>

	<rule id="SHORT_FORMS_HAVE" name="Avoid short forms (we've etc.)">
		<pattern lang="en">".*" "'ve"</pattern>
		<message>Suggestion: use a long form like <em>\1 have</em> instead for formal texts.</message>
		<example type="correct">Questions <em>we have</em> asked some people.</example>
		<example type="incorrect">Questions <em>we've</em> asked some people.</example>
	</rule>

	<rule id="SHORT_FORMS_ARE" name="Avoid short forms (we're etc.)">
		<pattern lang="en">".*" "'re"</pattern>
		<message>Suggestion: use a long form like <em>\1 are</em> instead for formal texts.</message>
		<example type="correct">What <em>We Are</em> Reading</example>
		<example type="incorrect">What <em>We're</em> Reading</example>
	</rule>

	<rule id="OR_SENT_START" name="Avoid 'Or' at the beginning of a sentence">
		<pattern lang="en" mark_from="0" mark_to="-1">SENT_START "or"</pattern>
		<message>Suggestion: don't start a sentence with <em>or</em>.</message>
		<example type="correct"><em>Instead</em>, one could think about other approaches.</example>
		<example type="incorrect"><em>Or</em> one could think about other approaches.</example>
	</rule>

	<rule id="BILLION" name="Avoid 'billion'">
		<pattern lang="en">"billion"</pattern>
		<message>Suggestion: use <em>thousand million</em> instead of billion to avoid ambiguities.</message>
		<example type="correct">Feds "Misplaced" $17.3 <em>Thousand Million</em> Last Year</example>
		<example type="incorrect">Feds "Misplaced" $17.3 <em>Billion</em> Last Year</example>
	</rule>

</rules>
